  姝ｅ湪纭畾瑕佽繕鍘熺殑椤圭洰鈥?
  鎵€鏈夐」鐩潎鏄渶鏂扮殑锛屾棤娉曡繕鍘熴€?
  Microsoft.Extensions.AI.VllmChatClient -> D:\github\Microsoft.Extensions.AI.VllmChatClient\Microsoft.Extensions.AI.VllmChatClient\bin\Debug\net8.0\Microsoft.Extensions.AI.VllmChatClient.dll
D:\github\Microsoft.Extensions.AI.VllmChatClient\VllmChatClient.Test\KimiK2Tests.cs(27,13): warning CS0162: 妫€娴嬪埌鏃犳硶璁块棶鐨勪唬鐮?[D:\github\Microsoft.Extensions.AI.VllmChatClient\VllmChatClient.Test\VllmChatClient.Test.csproj]
D:\github\Microsoft.Extensions.AI.VllmChatClient\VllmChatClient.Test\GptOssChatTest.cs(16,35): warning CS8601: 鍙兘鐨?null 寮曠敤璧嬪€笺€?[D:\github\Microsoft.Extensions.AI.VllmChatClient\VllmChatClient.Test\VllmChatClient.Test.csproj]
D:\github\Microsoft.Extensions.AI.VllmChatClient\VllmChatClient.Test\GptOssChatTest.cs(73,37): warning CS8604: 鈥淢atch Regex.Match(string input, string pattern, RegexOptions options)鈥濅腑鐨勫舰鍙傗€渋nput鈥濆彲鑳戒紶鍏?null 寮曠敤瀹炲弬銆?[D:\github\Microsoft.Extensions.AI.VllmChatClient\VllmChatClient.Test\VllmChatClient.Test.csproj]
D:\github\Microsoft.Extensions.AI.VllmChatClient\VllmChatClient.Test\Qwen3coderNextTests.cs(54,17): warning CS8602: 瑙ｅ紩鐢ㄥ彲鑳藉嚭鐜扮┖寮曠敤銆?[D:\github\Microsoft.Extensions.AI.VllmChatClient\VllmChatClient.Test\VllmChatClient.Test.csproj]
D:\github\Microsoft.Extensions.AI.VllmChatClient\VllmChatClient.Test\Qwen3NextChatTests.cs(57,17): warning CS8602: 瑙ｅ紩鐢ㄥ彲鑳藉嚭鐜扮┖寮曠敤銆?[D:\github\Microsoft.Extensions.AI.VllmChatClient\VllmChatClient.Test\VllmChatClient.Test.csproj]
D:\github\Microsoft.Extensions.AI.VllmChatClient\VllmChatClient.Test\KimiK2Tests.cs(78,17): warning CS8602: 瑙ｅ紩鐢ㄥ彲鑳藉嚭鐜扮┖寮曠敤銆?[D:\github\Microsoft.Extensions.AI.VllmChatClient\VllmChatClient.Test\VllmChatClient.Test.csproj]
D:\github\Microsoft.Extensions.AI.VllmChatClient\VllmChatClient.Test\QwQChatTest.cs(43,37): warning CS8604: 鈥淢atch Regex.Match(string input, string pattern, RegexOptions options)鈥濅腑鐨勫舰鍙傗€渋nput鈥濆彲鑳戒紶鍏?null 寮曠敤瀹炲弬銆?[D:\github\Microsoft.Extensions.AI.VllmChatClient\VllmChatClient.Test\VllmChatClient.Test.csproj]
D:\github\Microsoft.Extensions.AI.VllmChatClient\VllmChatClient.Test\Gemma3ChatTest.cs(106,37): warning CS8604: 鈥淢atch Regex.Match(string input, string pattern, RegexOptions options)鈥濅腑鐨勫舰鍙傗€渋nput鈥濆彲鑳戒紶鍏?null 寮曠敤瀹炲弬銆?[D:\github\Microsoft.Extensions.AI.VllmChatClient\VllmChatClient.Test\VllmChatClient.Test.csproj]
D:\github\Microsoft.Extensions.AI.VllmChatClient\VllmChatClient.Test\Qwen2507ReasoningChatTests.cs(65,37): warning CS8604: 鈥淢atch Regex.Match(string input, string pattern, RegexOptions options)鈥濅腑鐨勫舰鍙傗€渋nput鈥濆彲鑳戒紶鍏?null 寮曠敤瀹炲弬銆?[D:\github\Microsoft.Extensions.AI.VllmChatClient\VllmChatClient.Test\VllmChatClient.Test.csproj]
D:\github\Microsoft.Extensions.AI.VllmChatClient\VllmChatClient.Test\Qwen3ChatTest.cs(156,37): warning CS8604: 鈥淢atch Regex.Match(string input, string pattern, RegexOptions options)鈥濅腑鐨勫舰鍙傗€渋nput鈥濆彲鑳戒紶鍏?null 寮曠敤瀹炲弬銆?[D:\github\Microsoft.Extensions.AI.VllmChatClient\VllmChatClient.Test\VllmChatClient.Test.csproj]
D:\github\Microsoft.Extensions.AI.VllmChatClient\VllmChatClient.Test\Gemma3ChatTest.cs(181,26): warning CS0219: 鍙橀噺鈥渕ediaType鈥濆凡琚祴鍊硷紝浣嗕粠鏈娇鐢ㄨ繃瀹冪殑鍊?[D:\github\Microsoft.Extensions.AI.VllmChatClient\VllmChatClient.Test\VllmChatClient.Test.csproj]
D:\github\Microsoft.Extensions.AI.VllmChatClient\VllmChatClient.Test\Gemma3ChatTest.cs(376,40): warning CS8602: 瑙ｅ紩鐢ㄥ彲鑳藉嚭鐜扮┖寮曠敤銆?[D:\github\Microsoft.Extensions.AI.VllmChatClient\VllmChatClient.Test\VllmChatClient.Test.csproj]
D:\github\Microsoft.Extensions.AI.VllmChatClient\VllmChatClient.Test\Gemini3Test.cs(335,49): warning CS8602: 瑙ｅ紩鐢ㄥ彲鑳藉嚭鐜扮┖寮曠敤銆?[D:\github\Microsoft.Extensions.AI.VllmChatClient\VllmChatClient.Test\VllmChatClient.Test.csproj]
D:\github\Microsoft.Extensions.AI.VllmChatClient\VllmChatClient.Test\Gemini3Test.cs(431,49): warning CS8602: 瑙ｅ紩鐢ㄥ彲鑳藉嚭鐜扮┖寮曠敤銆?[D:\github\Microsoft.Extensions.AI.VllmChatClient\VllmChatClient.Test\VllmChatClient.Test.csproj]
D:\github\Microsoft.Extensions.AI.VllmChatClient\VllmChatClient.Test\Gemini3Test.cs(609,45): warning CS8602: 瑙ｅ紩鐢ㄥ彲鑳藉嚭鐜扮┖寮曠敤銆?[D:\github\Microsoft.Extensions.AI.VllmChatClient\VllmChatClient.Test\VllmChatClient.Test.csproj]
D:\github\Microsoft.Extensions.AI.VllmChatClient\VllmChatClient.Test\Gemini3Test.cs(772,68): warning CS8602: 瑙ｅ紩鐢ㄥ彲鑳藉嚭鐜扮┖寮曠敤銆?[D:\github\Microsoft.Extensions.AI.VllmChatClient\VllmChatClient.Test\VllmChatClient.Test.csproj]
D:\github\Microsoft.Extensions.AI.VllmChatClient\VllmChatClient.Test\Gemini3Test.cs(776,78): warning CS8602: 瑙ｅ紩鐢ㄥ彲鑳藉嚭鐜扮┖寮曠敤銆?[D:\github\Microsoft.Extensions.AI.VllmChatClient\VllmChatClient.Test\VllmChatClient.Test.csproj]
D:\github\Microsoft.Extensions.AI.VllmChatClient\VllmChatClient.Test\Gemini3Test.cs(780,80): warning CS8602: 瑙ｅ紩鐢ㄥ彲鑳藉嚭鐜扮┖寮曠敤銆?[D:\github\Microsoft.Extensions.AI.VllmChatClient\VllmChatClient.Test\VllmChatClient.Test.csproj]
D:\github\Microsoft.Extensions.AI.VllmChatClient\VllmChatClient.Test\DeepseekR1Test.cs(32,13): warning xUnit2013: Do not use Assert.Equal() to check for collection size. Use Assert.Single instead. (https://xunit.net/xunit.analyzers/rules/xUnit2013) [D:\github\Microsoft.Extensions.AI.VllmChatClient\VllmChatClient.Test\VllmChatClient.Test.csproj]
D:\github\Microsoft.Extensions.AI.VllmChatClient\VllmChatClient.Test\QwQChatTest.cs(27,13): warning xUnit2013: Do not use Assert.Equal() to check for collection size. Use Assert.Single instead. (https://xunit.net/xunit.analyzers/rules/xUnit2013) [D:\github\Microsoft.Extensions.AI.VllmChatClient\VllmChatClient.Test\VllmChatClient.Test.csproj]
D:\github\Microsoft.Extensions.AI.VllmChatClient\VllmChatClient.Test\GptOssChatTest.cs(53,13): warning xUnit2013: Do not use Assert.Equal() to check for collection size. Use Assert.Single instead. (https://xunit.net/xunit.analyzers/rules/xUnit2013) [D:\github\Microsoft.Extensions.AI.VllmChatClient\VllmChatClient.Test\VllmChatClient.Test.csproj]
D:\github\Microsoft.Extensions.AI.VllmChatClient\VllmChatClient.Test\Qwen2507ReasoningChatTests.cs(39,13): warning xUnit2013: Do not use Assert.Equal() to check for collection size. Use Assert.Single instead. (https://xunit.net/xunit.analyzers/rules/xUnit2013) [D:\github\Microsoft.Extensions.AI.VllmChatClient\VllmChatClient.Test\VllmChatClient.Test.csproj]
D:\github\Microsoft.Extensions.AI.VllmChatClient\VllmChatClient.Test\Gemma3ChatTest.cs(33,13): warning xUnit2013: Do not use Assert.Equal() to check for collection size. Use Assert.Single instead. (https://xunit.net/xunit.analyzers/rules/xUnit2013) [D:\github\Microsoft.Extensions.AI.VllmChatClient\VllmChatClient.Test\VllmChatClient.Test.csproj]
D:\github\Microsoft.Extensions.AI.VllmChatClient\VllmChatClient.Test\Qwen2507ReasoningChatTests.cs(40,13): warning xUnit2009: Do not use Assert.True() to check for substrings. Use Assert.Contains instead. (https://xunit.net/xunit.analyzers/rules/xUnit2009) [D:\github\Microsoft.Extensions.AI.VllmChatClient\VllmChatClient.Test\VllmChatClient.Test.csproj]
D:\github\Microsoft.Extensions.AI.VllmChatClient\VllmChatClient.Test\Qwen2507ChatTests.cs(33,13): warning xUnit2009: Do not use Assert.True() to check for substrings. Use Assert.Contains instead. (https://xunit.net/xunit.analyzers/rules/xUnit2009) [D:\github\Microsoft.Extensions.AI.VllmChatClient\VllmChatClient.Test\VllmChatClient.Test.csproj]
D:\github\Microsoft.Extensions.AI.VllmChatClient\VllmChatClient.Test\Qwen3VLTests.cs(54,13): warning xUnit2009: Do not use Assert.True() to check for substrings. Use Assert.Contains instead. (https://xunit.net/xunit.analyzers/rules/xUnit2009) [D:\github\Microsoft.Extensions.AI.VllmChatClient\VllmChatClient.Test\VllmChatClient.Test.csproj]
D:\github\Microsoft.Extensions.AI.VllmChatClient\VllmChatClient.Test\Qwen3coderNextTests.cs(53,13): warning xUnit2009: Do not use Assert.True() to check for substrings. Use Assert.Contains instead. (https://xunit.net/xunit.analyzers/rules/xUnit2009) [D:\github\Microsoft.Extensions.AI.VllmChatClient\VllmChatClient.Test\VllmChatClient.Test.csproj]
D:\github\Microsoft.Extensions.AI.VllmChatClient\VllmChatClient.Test\Qwen3NextChatTests.cs(56,13): warning xUnit2009: Do not use Assert.True() to check for substrings. Use Assert.Contains instead. (https://xunit.net/xunit.analyzers/rules/xUnit2009) [D:\github\Microsoft.Extensions.AI.VllmChatClient\VllmChatClient.Test\VllmChatClient.Test.csproj]
D:\github\Microsoft.Extensions.AI.VllmChatClient\VllmChatClient.Test\Glm4647Tests.cs(82,13): warning xUnit2009: Do not use Assert.True() to check for substrings. Use Assert.Contains instead. (https://xunit.net/xunit.analyzers/rules/xUnit2009) [D:\github\Microsoft.Extensions.AI.VllmChatClient\VllmChatClient.Test\VllmChatClient.Test.csproj]
D:\github\Microsoft.Extensions.AI.VllmChatClient\VllmChatClient.Test\KimiK2Tests.cs(77,13): warning xUnit2009: Do not use Assert.True() to check for substrings. Use Assert.Contains instead. (https://xunit.net/xunit.analyzers/rules/xUnit2009) [D:\github\Microsoft.Extensions.AI.VllmChatClient\VllmChatClient.Test\VllmChatClient.Test.csproj]
D:\github\Microsoft.Extensions.AI.VllmChatClient\VllmChatClient.Test\Qwen2507ChatTests.cs(108,13): warning xUnit2009: Do not use Assert.True() to check for substrings. Use Assert.Contains instead. (https://xunit.net/xunit.analyzers/rules/xUnit2009) [D:\github\Microsoft.Extensions.AI.VllmChatClient\VllmChatClient.Test\VllmChatClient.Test.csproj]
D:\github\Microsoft.Extensions.AI.VllmChatClient\VllmChatClient.Test\Gemma3ChatTest.cs(233,13): warning xUnit2009: Do not use Assert.True() to check for substrings. Use Assert.Contains instead. (https://xunit.net/xunit.analyzers/rules/xUnit2009) [D:\github\Microsoft.Extensions.AI.VllmChatClient\VllmChatClient.Test\VllmChatClient.Test.csproj]
D:\github\Microsoft.Extensions.AI.VllmChatClient\VllmChatClient.Test\Gemma3ChatTest.cs(252,13): warning xUnit2009: Do not use Assert.True() to check for substrings. Use Assert.Contains instead. (https://xunit.net/xunit.analyzers/rules/xUnit2009) [D:\github\Microsoft.Extensions.AI.VllmChatClient\VllmChatClient.Test\VllmChatClient.Test.csproj]
  VllmChatClient.Test -> D:\github\Microsoft.Extensions.AI.VllmChatClient\VllmChatClient.Test\bin\Debug\net8.0\VllmChatClient.Test.dll
D:\github\Microsoft.Extensions.AI.VllmChatClient\VllmChatClient.Test\bin\Debug\net8.0\VllmChatClient.Test.dll (.NETCoreApp,Version=v8.0)鐨勬祴璇曡繍琛?
VSTest 鐗堟湰 18.0.1 (x64)

姝ｅ湪鍚姩娴嬭瘯鎵ц锛岃绋嶅€?..
鎬诲叡 1 涓祴璇曟枃浠朵笌鎸囧畾妯″紡鐩稿尮閰嶃€?
[xUnit.net 00:00:07.02]     VllmChatClient.Test.GptOssChatTest.StreamChatTest [FAIL]
  澶辫触 VllmChatClient.Test.GptOssChatTest.StreamChatTest [4 s]
  閿欒娑堟伅:
   System.Text.Json.JsonException : ':' is an invalid start of a value. Path: $ | LineNumber: 0 | BytePositionInLine: 0.
---- System.Text.Json.JsonReaderException : ':' is an invalid start of a value. LineNumber: 0 | BytePositionInLine: 0.
  鍫嗘爤璺熻釜:
     at System.Text.Json.ThrowHelper.ReThrowWithPath(ReadStack& state, JsonReaderException ex)
   at System.Text.Json.Serialization.JsonConverter`1.ReadCore(Utf8JsonReader& reader, JsonSerializerOptions options, ReadStack& state)
   at System.Text.Json.JsonSerializer.ReadFromSpan[TValue](ReadOnlySpan`1 utf8Json, JsonTypeInfo`1 jsonTypeInfo, Nullable`1 actualByteCount)
   at System.Text.Json.JsonSerializer.ReadFromSpan[TValue](ReadOnlySpan`1 json, JsonTypeInfo`1 jsonTypeInfo)
   at System.Text.Json.JsonSerializer.Deserialize[TValue](String json, JsonTypeInfo`1 jsonTypeInfo)
   at Microsoft.Extensions.AI.VllmBaseChatClient.GetStreamingResponseAsync(IEnumerable`1 messages, ChatOptions options, CancellationToken cancellationToken)+MoveNext() in D:\github\Microsoft.Extensions.AI.VllmChatClient\Microsoft.Extensions.AI.VllmChatClient\Public\VllmBaseChatClient.cs:line 182
   at Microsoft.Extensions.AI.VllmBaseChatClient.GetStreamingResponseAsync(IEnumerable`1 messages, ChatOptions options, CancellationToken cancellationToken)+System.Threading.Tasks.Sources.IValueTaskSource<System.Boolean>.GetResult()
   at VllmChatClient.Test.GptOssChatTest.StreamChatTest() in D:\github\Microsoft.Extensions.AI.VllmChatClient\VllmChatClient.Test\GptOssChatTest.cs:line 122
   at VllmChatClient.Test.GptOssChatTest.StreamChatTest() in D:\github\Microsoft.Extensions.AI.VllmChatClient\VllmChatClient.Test\GptOssChatTest.cs:line 122
--- End of stack trace from previous location ---
----- Inner Stack Trace -----
   at System.Text.Json.ThrowHelper.ThrowJsonReaderException(Utf8JsonReader& json, ExceptionResource resource, Byte nextByte, ReadOnlySpan`1 bytes)
   at System.Text.Json.Utf8JsonReader.ConsumeValue(Byte marker)
   at System.Text.Json.Utf8JsonReader.ReadFirstToken(Byte first)
   at System.Text.Json.Utf8JsonReader.ReadSingleSegment()
   at System.Text.Json.Utf8JsonReader.Read()
   at System.Text.Json.Serialization.JsonConverter`1.ReadCore(Utf8JsonReader& reader, JsonSerializerOptions options, ReadStack& state)
[xUnit.net 00:00:31.91]     VllmChatClient.Test.GptOssChatTest.TestReasoningLevelChainLengthComparison [FAIL]
  澶辫触 VllmChatClient.Test.GptOssChatTest.TestReasoningLevelChainLengthComparison [24 s]
  閿欒娑堟伅:
   Medium level should produce some reasoning content
  鍫嗘爤璺熻釜:
     at VllmChatClient.Test.GptOssChatTest.TestReasoningLevelChainLengthComparison() in D:\github\Microsoft.Extensions.AI.VllmChatClient\VllmChatClient.Test\GptOssChatTest.cs:line 500
--- End of stack trace from previous location ---
  鏍囧噯杈撳嚭娑堟伅:
 
=== Testing Low Level ===
 Current thinking length: 3
 Current thinking length: 8
 Current thinking length: 14
 Current thinking length: 16
 Current thinking length: 21
 Current thinking length: 24
 Current thinking length: 29
 Current thinking length: 39
 Current thinking length: 42
 Current thinking length: 48
 Current thinking length: 50
 Current thinking length: 55
 Current thinking length: 60
 Current thinking length: 68
 Current thinking length: 69
 Current thinking length: 72
 Current thinking length: 77
 Current thinking length: 84
 Current thinking length: 85
 Current thinking length: 88
 Current thinking length: 95
 Current thinking length: 104
 Current thinking length: 107
 Current thinking length: 115
 Current thinking length: 124
 Current thinking length: 125
 Final thinking length for Low: 125
 Final answer length: 634
 
=== Testing Medium Level ===
 Error testing Medium: ':' is an invalid start of a value. Path: $ | LineNumber: 0 | BytePositionInLine: 0.
 
=== Testing High Level ===
 Current thinking length: 3
 Current thinking length: 8
 Current thinking length: 13
 Current thinking length: 15
 Current thinking length: 20
 Current thinking length: 28
 Current thinking length: 29
 Current thinking length: 37
 Current thinking length: 44
 Current thinking length: 45
 Current thinking length: 49
 Current thinking length: 50
 Current thinking length: 51
 Current thinking length: 52
 Current thinking length: 53
 Current thinking length: 58
 Current thinking length: 63
 Current thinking length: 66
 Current thinking length: 76
 Current thinking length: 77
 Current thinking length: 86
 Current thinking length: 87
 Current thinking length: 88
 Current thinking length: 89
 Current thinking length: 94
 Current thinking length: 97
 Current thinking length: 102
 Current thinking length: 107
 Current thinking length: 110
 Current thinking length: 115
 Current thinking length: 125
 Current thinking length: 128
 Current thinking length: 130
 Current thinking length: 136
 Current thinking length: 141
 Current thinking length: 144
 Current thinking length: 149
 Current thinking length: 153
 Current thinking length: 158
 Current thinking length: 159
 Current thinking length: 162
 Current thinking length: 169
 Current thinking length: 178
 Current thinking length: 181
 Current thinking length: 183
 Current thinking length: 188
 Current thinking length: 195
 Current thinking length: 201
 Current thinking length: 202
 Current thinking length: 205
 Current thinking length: 210
 Current thinking length: 216
 Current thinking length: 217
 Current thinking length: 225
 Current thinking length: 233
 Current thinking length: 242
 Current thinking length: 249
 Current thinking length: 254
 Current thinking length: 266
 Current thinking length: 269
 Current thinking length: 274
 Current thinking length: 282
 Current thinking length: 283
 Current thinking length: 287
 Current thinking length: 295
 Current thinking length: 297
 Current thinking length: 299
 Current thinking length: 300
 Current thinking length: 306
 Current thinking length: 310
 Current thinking length: 311
 Current thinking length: 312
 Current thinking length: 313
 Current thinking length: 314
 Current thinking length: 317
 Current thinking length: 319
 Current thinking length: 320
 Current thinking length: 330
 Current thinking length: 332
 Current thinking length: 334
 Current thinking length: 336
 Current thinking length: 338
 Current thinking length: 339
 Current thinking length: 340
 Current thinking length: 342
 Current thinking length: 343
 Current thinking length: 344
 Current thinking length: 345
 Current thinking length: 346
 Current thinking length: 347
 Current thinking length: 348
 Current thinking length: 353
 Current thinking length: 357
 Current thinking length: 362
 Current thinking length: 365
 Current thinking length: 375
 Current thinking length: 376
 Current thinking length: 381
 Current thinking length: 384
 Current thinking length: 385
 Current thinking length: 386
 Current thinking length: 387
 Current thinking length: 388
 Current thinking length: 389
 Current thinking length: 391
 Current thinking length: 393
 Current thinking length: 394
 Current thinking length: 395
 Current thinking length: 396
 Current thinking length: 402
 Current thinking length: 409
 Current thinking length: 416
 Current thinking length: 417
 Current thinking length: 427
 Current thinking length: 429
 Current thinking length: 430
 Current thinking length: 431
 Current thinking length: 432
 Current thinking length: 433
 Current thinking length: 434
 Current thinking length: 436
 Current thinking length: 438
 Current thinking length: 439
 Current thinking length: 440
 Current thinking length: 442
 Current thinking length: 444
 Current thinking length: 445
 Current thinking length: 446
 Current thinking length: 447
 Current thinking length: 452
 Current thinking length: 459
 Current thinking length: 460
 Current thinking length: 461
 Current thinking length: 462
 Current thinking length: 465
 Current thinking length: 467
 Current thinking length: 469
 Current thinking length: 470
 Current thinking length: 472
 Current thinking length: 475
 Current thinking length: 482
 Current thinking length: 488
 Current thinking length: 489
 Current thinking length: 495
 Current thinking length: 501
 Current thinking length: 511
 Current thinking length: 514
 Current thinking length: 520
 Current thinking length: 523
 Current thinking length: 531
 Current thinking length: 534
 Current thinking length: 539
 Current thinking length: 548
 Current thinking length: 549
 Current thinking length: 557
 Current thinking length: 566
 Current thinking length: 576
 Current thinking length: 579
 Current thinking length: 581
 Current thinking length: 586
 Current thinking length: 592
 Current thinking length: 593
 Final thinking length for High: 593
 Final answer length: 368
 
=== Final Results ===
 === Low Level ===
 Thinking Length: 125
 Thinking Tokens: 178
 Reasoning Preview: The user wants a step-by-step reasoning to solve a math word problem. No tool needed. So answer directly in natural language.
 
 === Medium Level ===
 Thinking Length: 0
 Thinking Tokens: 0
 Reasoning Preview: Error: ':' is an invalid start of a value. Path: $ | LineNumber: 0 | BytePositionInLine: 0.
 
 === High Level ===
 Thinking Length: 593
 Thinking Tokens: 835
 Reasoning Preview: The user asks a math problem: initial apples, ate 1/3 then half of remaining, leftover 6. Need to give step-by-step reasoning.

We don't need to call any tool. So answer directly.

We must follow rules: No tool calls. Provide natural language answer with explanation.

Let's compute: Let initial = x....
 


[xUnit.net 00:00:33.37]     VllmChatClient.Test.GptOssChatTest.StreamChatManualFunctionCallTest [FAIL]
  澶辫触 VllmChatClient.Test.GptOssChatTest.StreamChatManualFunctionCallTest [1 s]
  閿欒娑堟伅:
   System.Text.Json.JsonException : ':' is an invalid start of a value. Path: $ | LineNumber: 0 | BytePositionInLine: 0.
---- System.Text.Json.JsonReaderException : ':' is an invalid start of a value. LineNumber: 0 | BytePositionInLine: 0.
  鍫嗘爤璺熻釜:
     at System.Text.Json.ThrowHelper.ReThrowWithPath(ReadStack& state, JsonReaderException ex)
   at System.Text.Json.Serialization.JsonConverter`1.ReadCore(Utf8JsonReader& reader, JsonSerializerOptions options, ReadStack& state)
   at System.Text.Json.JsonSerializer.ReadFromSpan[TValue](ReadOnlySpan`1 json, JsonTypeInfo`1 jsonTypeInfo)
   at System.Text.Json.JsonSerializer.Deserialize[TValue](String json, JsonTypeInfo`1 jsonTypeInfo)
   at Microsoft.Extensions.AI.VllmBaseChatClient.GetStreamingResponseAsync(IEnumerable`1 messages, ChatOptions options, CancellationToken cancellationToken)+MoveNext() in D:\github\Microsoft.Extensions.AI.VllmChatClient\Microsoft.Extensions.AI.VllmChatClient\Public\VllmBaseChatClient.cs:line 182
   at Microsoft.Extensions.AI.VllmBaseChatClient.GetStreamingResponseAsync(IEnumerable`1 messages, ChatOptions options, CancellationToken cancellationToken)+System.Threading.Tasks.Sources.IValueTaskSource<System.Boolean>.GetResult()
   at VllmChatClient.Test.GptOssChatTest.StreamChatManualFunctionCallTest() in D:\github\Microsoft.Extensions.AI.VllmChatClient\VllmChatClient.Test\GptOssChatTest.cs:line 257
   at VllmChatClient.Test.GptOssChatTest.StreamChatManualFunctionCallTest() in D:\github\Microsoft.Extensions.AI.VllmChatClient\VllmChatClient.Test\GptOssChatTest.cs:line 257
--- End of stack trace from previous location ---
----- Inner Stack Trace -----
   at System.Text.Json.ThrowHelper.ThrowJsonReaderException(Utf8JsonReader& json, ExceptionResource resource, Byte nextByte, ReadOnlySpan`1 bytes)
   at System.Text.Json.Utf8JsonReader.ConsumeValue(Byte marker)
   at System.Text.Json.Utf8JsonReader.ReadFirstToken(Byte first)
   at System.Text.Json.Utf8JsonReader.ReadSingleSegment()
   at System.Text.Json.Serialization.JsonConverter`1.ReadCore(Utf8JsonReader& reader, JsonSerializerOptions options, ReadStack& state)

澶辫触!  - 澶辫触:     3锛岄€氳繃:     3锛屽凡璺宠繃:     0锛屾€昏:     6锛屾寔缁椂闂? 44 s - VllmChatClient.Test.dll (net8.0)
